ReleveAnnee,ReleveMois,NoOrdre,TitreRMC,AdopCSRegleVote,AdopCSAbs,AdoptCSContre,NoCELEX,ProposAnnee,ProposChrono,ProposOrigine,NoUniqueAnnee,NoUniqueType,NoUniqueChrono,ProposSplittee,Suite2eLecturePE,"Council Path",Notes
2007,1,1,"Directive 2007/2/EC of the European Parliament and of the Council of 14 March 2007 establishing an Infrastructure for Spatial Information in the European Community (INSPIRE)",V,,,32007L0002,2004,516,COM,2004,COD,175,,,,
2007,1,2,"Council decision authorising Romania to apply a reduced rate of VAT to certain labour-intensive services referred to in Article 106 of Directive 2006/112/EC",V,,,32007D0050,2006,736,COM,NULL,CS,NULL,,,,
2007,1,3,"Council Decision extending the application of Decision 2000/91/EC authorising the Kingdom of Denmark and the Kingdom of Sweden to apply a measure derogating from Article 17 of the Sixth Council Directive (77/388/EC) on the harmonisation of the laws of the Member States relating to turnover taxes",U,,,32007D0132,2006,796,COM,NULL,CS,NULL,,,,
2007,1,4,"Council Decision authorising Estonia, Slovenia, Sweden and the United Kingdom to apply a special measure derogating from Article 167 of Council Directive 2006/112/EC on the common system of value added tax",U,,,32007D0133,2006,802,COM,NULL,CS,NULL,,,,
2007,2,1,"Council Regulation providing for duty-free treatment for specified pharmaceutical active ingredients bearing an ""international non-proprietary name"" (INN) from the World Health Organisation and specified products used for the manufacture of finished pharmaceuticals and amending Annex I to Regulation (EEC) No 2658/87",V,,,32007R0129,2006,616,COM,2006,ACC,204,,,,
2007,2,2,"Council Regulation establishing a European Union Agency for Fundamental Rights",U,,,32007R0168,2005,"280 - 1",COM,2005,CNS,124,,,,"Proposchrono  in ŒIL and Celex documents is wrong (280). 280-1 as indicated in Pre-lex document is right"
2007,2,3,"Council Regulation amending Annex V to Regulation (EC) No 850/2004 of the European Parliament and of the Council on persistent organic pollutants",V,,"BE, DK, FR",32007R0172,2006,252,COM,NULL,CS,NULL,,,,"Proposannée, ProposChrono and Proposorigine are not in the Celex document"
2007,2,4,"Council Regulation establishing an Instrument for Nuclear Safety Cooperation",U,,,32007R0300,2004,630,COM,2006,CNS,802,Y,,,"Two Celex references in Pre-lex document. The right one is 32007R0300. NUnique on  Prelex and Celex  documents (COD 2004 223) is wrong. It refers to the act that comes from the splitted proposal.the right N°Unique is 2006/CNS/802."
2007,2,5,"Council Regulation on the establishment of a Joint Undertaking to develop the new generation European air traffic management system (SESAR)",V,,,32007R0219,2005,"602 - 2",COM,2005,CNS,235,,,,"Proposchrono in ŒIL and Celex documents is wrong (602). 602-2 as indicated in Pre-lex document is correct"
2007,3,1,"Council Decision establishing a Civil Protection Financial Instrument",U,,,32007D0162,2005,113,COM,2005,CNS,52,,,,
2007,3,2,"Council Regulation laying down transitional measures derogating from Regulation (EC) No 2597/97as regards drinking milk produced in Estonia",V,,,32007R0315,2007,48,COM,2007,CNS,21,,,,
2007,3,3,"Council Regulation amending Annex I to Regulation (EEC) No 2658/87 on the tariff and statistical nomenclature and on the Common Customs Tariff",V,,,32007R0301,2006,788,COM,NULL,CS,NULL,,,,"Proposannée, ProposChrono and Proposorigine are missing in the Celex document"
2007,3,4,"Regulation of the European Parliament and of the Council amending Regulation (EC) No 417/2002 on the accelerated phasing-in of double-hull or equivalent design requirements for single-hull oil tankers",V,EL,,32007R0457,2006,111,COM,2006,COD,46,,,,"Proposannée, ProposChrono and Proposorigine are missing in the Celex document"
2007,3,5,"Regulation of the European Parliament and of the Council on the European system of integrated social protection statistics (ESSPROS)",V,,,32007R0458,2006,11,COM,2006,COD,4,,,,
2007,3,6,"Council Decision establishing the European Joint Undertaking for ITER and the Development of Fusion Energy and conferring advantages upon it",U,,,32007D0198,2006,458,COM,NULL,CS,NULL,,,,"Proposannée, ProposChrono and Proposorigine are not on the Celex document"
2007,3,7,"Council Regulation laying down rules for voluntary modulation of direct payments provided for in Regulation (EC) No 1782/2003 establishing common rules for direct support schemes under the common agricultural policy and establishing certain support schemes for farmers, and amending Regulation (EC) No 1290/2005",V,"LV, ",,32007R0378,2006,241,COM,2006,CNS,83,,,,
2007,4,1,"Council Decision authorising the United Kingdom to introduce a special measure derogating from Article 193 of Directive 2006/112/EC on the common system of value added tax",U,,,32007D0250,2006,555,COM,NULL,CS,NULL,,,,"Proposannée, ProposChrono and Proposorigine are missing in the Celex document"
2007,4,2,"Decision of the European Parliament and of the Council amending Directive 2002/2/EC amending Council Directive 79/373/EEC on the circulation of compound feedingstuffs",V,,,32007D0623,2006,340,COM,2006,COD,117,,,,
2007,4,3,"Directive of the European Parliament and of the Council on the placing on the market of pyrotechnic articles",V,,,32007L0023,2005,457,COM,2005,COD,194,,,,
2007,4,4,"Decision of the European Parliament and of the Council establishing an action programme for customs in the Community (Customs 2013)",V,,,32007D0624,2006,201,COM,2006,COD,75,,,,"Proposannée, ProposChrono and Proposorigine are missing in the Celex document"
2007,4,5,"Directive of the European Parliament and of the Council repealing Council Directive 71/304/EEC concerning the abolition of restrictions on freedom to provide services in respect of public works contracts and on the award of public works contracts to contractors acting through agencies or branches",V,,,32007L0024,2006,748,COM,2006,COD,249,,,,"Proposannée, ProposChrono and Proposorigine are not on the Celex document"
2007,5,1,"Regulation of the European Parliament and of the Council concerning the Financial Instrument for the Environment (LIFE+)",V,,,32007R0614,2004,621,COM,2004,COD,218,,,,"Proposannée, ProposChrono and Proposorigine are not on the Celex document"
2007,5,2,"Council Regulation opening tariff quotas for imports into Bulgaria and Romania of raw cane sugar for supply to refineries in the marketing years 2006/2007, 2007/2008 and 2008/2009",V,UK,,32007R0508,2006,798,COM,2006,CNS,261,,,,
2007,5,3,"Council Regulation amending Regulation (EC) No 527/2003 authorising the offer and delivery for direct human consumption of certain wines imported from Argentina which may have undergone oenological processes not provided for in Regulation (EC) No 1493/1999",V,"ES, CY",,32007R0519,2007,92,COM,NULL,CS,NULL,,,,"Proposannée, ProposChrono and Proposorigine are not on the Celex document"
2007,5,4,"Council Regulation laying down technical measures for the conservation of certain stocks of highly migratory species and repealing Regulation (EC) No 973/2001",V,,,32007R0520,2006,100,COM,2006,CNS,30,,,,
2007,5,5,"Council Regulation establishing a multi-annual plan for the sustainable exploitation of the stock of sole in the Western Channel",V,,,32007R0509,2003,819,COM,2003,CNS,327,Y,,,"Proposannée, ProposChrono and Proposorigine are not on the Celex document"
2007,5,6,"Council Regulation amending Annex I to Regulation (EEC) No 2658/87 on the tariff and statistical nomenclature and on the Common Customs Tariff",V,,,32007R0501,2006,861,COM,NULL,CS,NULL,,,,"Proposannée, ProposChrono and Proposorigine are not on the Celex document"
2007,5,7,"Decision of the European Parliament and of the Council establishing the European Refugee Fund for the period 2008 to 2013 as part of the General programme ""Solidarity and Management of Migration Flows"" and repealing Council Decision 2004/904/EC",V,,UK,32007D0573,2005,"123 - 2",COM,2005,COD,46,,,,"Proposchrono in ŒIL and Celex documents is wrong (123). 123-2 as indicated in pre-lex document is correct"
2007,5,8,"Decision of the European Parliament and of the Council establishing the External Borders Fund for the period 2007 to 2013 as part of the General programme ""Solidarity and Management of Migration Flows""",V,,,32007D0574,2005,"123 - 3",COM,2005,COD,47,,,,"Proposchrono in ŒIL and Celex documents is wrong (123). 123-3 as indicated in pre-lex document is correct"
2007,5,9,"Decision of the European Parliament and of the Council establishing the European Return Fund for the period 2008 to 2013 as part of the General Programme ""Solidarity and Management of Migration Flows""",V,,UK,32007D0575,2005,"123 - 5",COM,2005,COD,49,,,,"Proposchrono in ŒIL and Celex documents is wrong (123). 123-5 as indicated in pre-lex document is correct"
2007,5,10,"Council Regulation on the implementation of Protocol No 9 on Unit 1 and Unit 2 of the Bohunice V1 nuclear power plant in Slovakia to the Act concerning the conditions of accession to the European Union of the Czech Republic, Estonia, Cyprus, Latvia, Lithuania, Hungary, Malta, Poland, Slovenia and Slovakia",U,,,32007R0549,2004,"624 - 2",COM,2004,CNS,221,,,,"Proposchrono in ŒIL and Celex documents is wrong (624). 624-2 as indicated in pre-lex document is correct"
2007,5,11,"Decision of the European Parliament and of the Council repealing Council Directive 68/89/EEC on the approximation of the laws of the Member States concerning the classification of wood in the rough",V,,,32007D0714,2006,557,COM,2006,COD,178,,,,
2007,5,12,"Regulation of the European Parliament and of the Council on Community statistics on the structure and activity of foreign affiliates",V,FI,,32007R0716,2005,88,COM,2005,COD,16,,,,
2007,5,13,"European Parliament and Council Directive amending Council Directive 89/391/EEC, its individual Directives and Council Directives 83/477/EEC, 91/383/EEC, 92/29/EEC and 94/33/EC with a view to simplifying and rationalising the reports on practical implementation",V,,,32007L0030,2006,390,COM,2006,COD,127,,,,
2007,5,14,"Regulation of the European Parliament and of the Council on type approval of motor vehicles with respect to emissions from light passenger and commercial vehicles (Euro 5 and Euro 6) and on access to vehicle repair and maintenance information",V,,UK,32007R0715,2005,683,COM,2005,COD,282,,,,
2007,5,15,"Regulation (EC) No 680/2007 of the European Parliament and of the Council of 20 June 2007 laying down general rules for the granting of Community financial aid in the field of the trans-European transport and energy networks",V,,,32007R0680,2004,475,COM,2004,COD,154,,Y,,"This act comes from the ADDENDUM summary"
2007,5,16,"Decision No 779/2007/EC of the European Parliament and of the Council of 20 June 2007 establishing for the period 2007-2013 a specific programme to prevent and combat violence against children, young people and women and to protect victims and groups at risk (Daphne III programme) as part of the General Programme Fundamental Rights and Justice",V,,,32007D0779,2005,"122 - 2",COM,2005,COD,37A,Y,Y,,"This act comes from the ADDENDUM summary. This is a splitted proposal. N°UniqueChrono in Prelex and Celex documents is wrong (37A instead of 37). 37A as indicated in OEIL document is correct. Proposchrono is not the same in the Prelex document (122 - 2) than in the others (122)"
2007,6,1,"Council Decision on the system of the European Communities' own resources",U,,,32007D0436,2006,"99 - 1",COM,2006,CNS,39,,,,"Proposchrono in ŒIL and Celex documents (99) is not correct. 99-1 as indicated in Pre-lex document is correct"
2007,6,2,"Council Regulation on the marketing of the meat of bovine animals aged twelve months or less",V,AT,"IE, EL, PT, UK",32007R0700,2006,487,COM,2006,CNS,162,,,,
2007,6,3,"Council Regulation amending Regulation (EC) No 1784/2003 on the common organisation of the market in cereals",V,"CY, HU","BG, DA, EL",32007R0735,2006,755,COM,2006,CNS,256,,,,"Proposannée, ProposChrono, Proposorigine, N°uniquetype, N°uniqueannée and N°uniquechrono are not on the Celex document"
2007,6,4,"Council Regulation amending Regulation (EEC) No 1883/78 laying down general rules for the financing of interventions by the European Agricultural Guidance and Guarantee Fund, Guarantee Section",V,UK,SK,32007R0734,2007,12,COM,2007,CNS,5,,,,
2007,6,5,"Council Regulation amending Regulation (EC) No 1868/94 establishing a quota system in relation to the production of potato starch",V,PL,LT,32007R0671,2006,"827 - 2",COM,2006,CNS,268,,,,"Proposchrono in ŒIL and Celex documents (827) is wrong. 827-2 as indicated in Pre-lex document is correct"
2007,6,6,"Council Directive on the control of potato cyst nematodes",V,,,32007L0033,2005,151,COM,2005,CNS,58,,,,
2007,6,7,"Council Regulation concerning use of alien and locally absent species in aquaculture",V,,,32007R0708,2006,154,COM,2006,CNS,56,,,,
2007,6,8,"Council Decision amending Decision 2004/585/EC establishing Regional Advisory Councils under the Common Fisheries Policy",V,,,32007D0409,2006,732,COM,2006,CNS,240,,,,"N°Uniqueannée is wrong on the Celex file (2007 instead of 2006)"
2007,6,9,"Council Regulation establishing a multi-annual plan for fisheries exploiting stocks of plaice and sole in the North Sea",V,,,32007R0676,2005,714,COM,2006,CNS,2,,,,
2007,6,10,"Council Regulation amending Council Regulation (EC) No 41/2007 as concerns the recovery plan for bluefin tuna recommended by the International Commission for the Conservation of Atlantic Tunas",V,,"IE, UK",32007R0643,2007,74,COM,NULL,CS,NULL,,,,"Proposannée, ProposChrono and Proposorigine are not on the Celex document"
2007,6,11,"Council Decision on the establishment, operation and use of the second generation Schengen Information System (SIS II)",U,,,32007D0533,2005,230,COM,2005,CNS,103,,,,
2007,6,12,"Council Decision on the application of the provisions of the Schengen acquis relating to the Schengen Information System in the Czech Republic, the Republic of Estonia, the Republic of Latvia, the Republic of Lithuania, the Republic of Hungary, the Republic of Malta, the Republic of Poland, the Republic of Slovenia and the Slovak Republic",U,,,32007D0471,2007,9032,CONS,2007,CNS,806,,,http://register.consilium.europa.eu/pdf/en/07/st09/st09032.en07.pdf,"Proposannée, ProposChrono, Proposorigine, N°uniquetype, N°uniqueannée and N°uniquechrono are not on the Celex document. "
2007,6,13,"Regulation of the European Parliament and of the Council establishing a mechanism for the creation of Rapid Border Intervention Teams and amending Council Regulation (EC) No 2007/2004 as regards that mechanism",V,,,32007R0863,2006,401,COM,2006,COD,140,,,,
2007,6,14,"Directive of the European Parliament and of the Council on the exercise of certain rights of shareholders in listed companies",V,,,32007L0036,2005,685,COM,2005,COD,265,,,,
2007,6,15,"Regulation of the European Parliament and of the Council on Community statistics on migration and international protection",V,FI,,32007R0862,2005,375,COM,2005,COD,156,,,,
2007,6,16,"Council Regulation amending the lists of insolvency proceedings, winding-up proceedings and liquidators in Annexes A, B and C to Regulation (EC) No 1346/2000 on insolvency proceedings",V,,,32007R0681,2007,70,COM,NULL,CS,NULL,,,,"Proposannée, ProposChrono and Proposorigine are not on the Celex document"
2007,6,17,"Regulation of the European Parliament and of the Council establishing a European Small Claims Procedure",V,,,32007R0861,2005,87,COM,2005,COD,20,,,,
2007,6,18,"Council Decision authorising the Italian Republic to apply measures derogating from Articles 26(1)(a) and168 of Directive 2006/112/EC on the common system of value added tax",U,,,32007D0441,2007,238,COM,NULL,CS,NULL,,,,"Proposannée, ProposChrono and Proposorigine are not on the Celex document"
2007,6,19,"Council Regulation amending Regulation (EC) No 1255/96 temporarily suspending the autonomous common customs tariff duties on certain industrial, agricultural and fishery products",V,,,32007R0729,2007,254,COM,NULL,CS,NULL,,,,"Proposannée, ProposChrono and Proposorigine are not on the Celex document"
2007,6,20,"Council Regulation amending Regulation (EC) No 2505/96 opening and providing for the administration of autonomous Community tariff quotas for certain agricultural and industrial products",V,,,32007R0728,2007,202,COM,NULL,CS,NULL,,,,"Proposannée, ProposChrono and Proposorigine are not on the Celex document"
2007,6,21,"Council Regulation granting derogations to Bulgaria and Romania from certain provisions of Regulation (EC) No 2371/2002 relating to reference levels of fishing fleets",V,,,32007R0783,2007,75,COM,NULL,CS,NULL,,,,"Proposannée, ProposChrono and Proposorigine are not on the Celex document"
2007,6,22,"Council Decision establishing the European Fund for the Integration of third-country nationals for the period 2007 to 2013 as part of the General programme ""Solidarity and Management of Migration Flows""",U,,,32007D0435,2005,"123 - 4",COM,2005,CNS,48,,,,"Proposchrono in ŒIL and Celex documents (123) is wrong. 123-4 as indicated in Pre-lex document is correct"
2007,6,23,"Council Decision amending the Decision of the Executive Committee set up by the 1990 Schengen Convention, amending the Financial Regulation on the costs of installing and operating the technical support function for the Schengen Information System (C.SIS)",U,,,32007D0472,2007,9950,CONS,NULL,CS,NULL,,,http://register.consilium.europa.eu/pdf/en/07/st09/st09950.en07.pdf,"Proposannée, ProposChrono, Proposorigine, N°uniquetype, N°uniqueannée and N°uniquechrono are not on the Celex document. "
2007,6,24,"Council Decision on declassifying certain parts of the SIRENE Manual adopted by the Executive Committee established by the Convention implementing the Schengen Agreement of 14 June 1985",U,,,32007D0473,2007,9952,CONS,NULL,CS,NULL,,,http://register.consilium.europa.eu/pdf/en/07/st09/st09952.en07.pdf,"Proposannée, ProposChrono, Proposorigine, N°uniquetype, N°uniqueannée and N°uniquechrono are not on the Celex document. "
2007,6,25,"Regulation of the European Parliament and of the Council on roaming on public mobile telephone networks within the Community and amending Directive 2002/21/EC on a common regulatory framework for electronic communications networks and services",V,,,32007R0717,2006,382,COM,2006,COD,133,,,,"N°Uniqueannée is wrong on the Celex file (2005 instead of 2006)"
2007,6,26,"Directive of the European Parliament and of the Council on the retrofitting of mirrors to heavy goods vehicles registered in the Community",V,,,32007L0038,2006,570,COM,2006,COD,183,,,,
2007,6,27,"Council Directive laying down minimum rules for the protection of chickens kept for meat production",V,,AT,32007L0043,2005,221,COM,2005,CNS,99,,,,
2007,6,28,"Council Regulation on organic production and labelling of organic products and repealing Regulation (EEC) No 2092/91",V,,"BE, EL, HU, IT",32007R0834,2005,"671 - 1",COM,2005,CNS,278,,,,"Proposannée, ProposChrono and Proposorigine are not on the Celex document. ProposChrono in ŒIL and celex documents (671) is wrong. 671-1 as indicated in Pre-lex document is correct"
2007,6,29,"Council Regulation amending Regulations (EC) No 1941/2006, (EC) No 2015/2006 and (EC) No 41/2007, as regards fishing opportunities and associated conditions for certain fish stocks",V,,,32007R0754,2007,201,COM,NULL,CS,NULL,,,,"Proposannée, ProposChrono and Proposorigine are not on the Celex document"
2007,6,30,"Directive of the European Parliament and of the Council amending Council Directive 92/49/EEC and Directives 2002/83/EC, 2004/39/EC, 2005/68/EC and 2006/48/EC as regards procedural rules and evaluation criteria for the prudential assessment of acquisitions and increase of  holdings in the financial sector",V,,,32007L0044,2006,507,COM,2006,COD,166,,,,
2007,6,31,"Decision of the European Parliament and of the Council amending and extending Decision No 804/2004/EC establishing a Community action programme to promote activities in the field of the protection of the Community's financial interests (Hercule II programme)",V,,,32007D0878,2006,"339 - 2",COM,2006,COD,114,,,,"Proposchrono in ŒIL and celex documents is wrong (339). 339-2 as indicated on Pre-lex document is correct"
2007,6,32,"Regulation of the European Parliament and of the Council on the law applicable to non-contractual obligations (""Rome II"")",V,,"EE, LV",32007R0864,2003,427,COM,2003,COD,168,,,,"ProposChrono is wrong on the Celex file (247 instead of 427)"
2007,6,33,"Council Regulation amending Regulations (EC) No 894/97, (EC) No 812/2004 and (EC) No 2187/2005 as concerns drift nets",V,,FR,32007R0809,2006,511,COM,2006,CNS,169,,,,
2007,7,1,"Council Decision on guidelines for the employment policies of the Member States",V,,,32007D0491,2006,815,COM,2006,CNS,271,,,,
2007,7,2,"Council Regulation opening and providing for the management of autonomous Community tariff quotas for certain fishery products for the period 2007 to 2009",V,,,32007R0824,2007,289,COM,NULL,CS,NULL,,,,"Proposannée, ProposChrono and Proposorigine are not on the Celex document"
2007,7,3,"Council Regulation amending Regulation (EC) No 2371/2002 on the conservation and sustainable exploitation of fisheries resources under the Common Fisheries Policy",V,,,32007R0865,2006,587,COM,2006,CNS,190,,,,
2007,7,4,"Council Decision in accordance with Article 122(2) of the Treaty on the adoption by Cyprus of the single currency on 1 January 2008",V,,,32007D0503,2007,256,COM,2007,CNS,90,,,,
2007,7,5,"Council Decision in accordance with Article 122(2) of the Treaty on the adoption by Malta of the single currency on 1 January 2008",V,,,32007D0504,2007,259,COM,2007,CNS,92,,,,
2007,7,6,"Council Regulation amending Regulation (EC) No 974/98 as regards the introduction of the euro in Cyprus",U,,,32007R0835,2007,257,COM,2007,CNB,91,,,,
2007,7,7,"Council Regulation amending Regulation (EC) No 974/98 as regards the introduction of the euro in Malta",U,,,32007R0836,2007,260,COM,2007,CNB,93,,,,
2007,7,8,"Directive of the European Parliament and of the Council laying down rules on nominal quantities for prepacked products, repealing Council Directives 75/106/EEC and 80/232/EEC, and amending Council Directive 76/211/EEC",V,,,32007L0045,2004,708,COM,2004,COD,248,,,,
2007,7,9,"Directive of the European Parliament and of the Council amending Council Directive 90/385/EEC on the approximation of the laws of the Member
States relating to active implantable medical devices, Council Directive 93/42/EEC concerning medical devices and Directive 98/8/EC concerning the placing of biocidal products on the market",V,,,32007L0047,2005,681,COM,2005,COD,263,,,,
2007,7,10,"Directive of the European Parliament and of the Council establishing a framework for the approval of motor vehicles and their trailers, and of systems, components and separate technical units intended for such vehicles",V,,,32007L0046,2003,418,COM,2003,COD,153,,,,
2007,7,11,"Directive 2007/51/EC of the European Parliament and of the Council of 25 September 2007 amending Council Directive 76/769/EEC relating to restrictions on the marketing of certain measuring devices containing mercury",V,,"DK, SE",32007L0051,2006,69,COM,2006,COD,18,,Y,,"This act comes from the ADDENDUM summary"
2007,9,1," Council Regulation amending and updating Regulation (EC) No 1334/2000 setting up a Community regime for the control of exports of dual-use items and technology",V,,,32007R1183,2007,419,COM,NULL,CS,NULL,,,,"ProposChrono in celex document (416) is wrong. 419 as indicated in Pre-lex document is correct"
2007,9,2,"Council Regulation amending Regulation (EC) No 601/2004 laying down certain control measures applicable to fishing activities in the area covered by the Convention on the conservation of Antarctic marine living resources and amending Regulations (EEC) No 3943/90, (EC) No 66/98 and (EC) No 1721/1999",V,,,32007R1099,2006,867,COM,2007,CNS,1,,,,
2007,9,3," Council Regulation establishing measures for the recovery of the stock of European eel",V,,,32007R1100,2005,472,COM,2005,CNS,201,,,,
2007,9,4,"Council Regulation establishing a multiannual plan for the cod stocks in the Baltic Sea and the fisheries exploiting those stocks, amending Regulation (EEC) No 2847/93 and repealing Regulation (EC) No 779/97",V,,,32007R1098,2006,411,COM,2006,CNS,134,,,,
2007,9,5,"Decision of the European Parliament and of the Council establishing for the period 2007-2013 the Specific Programme ""Civil Justice"" as part of the General Programme ""Fundamental Rights and Justice""",V,,,32007D1149,2005,"122 - 5",COM,2005,COD,40,,,,"Proposchrono in ŒIL and Celex documents is wrong (122). 122-5 as indicated on Pre-lex document is correct"
2007,9,6,"Directive of the European Parliament and of the Council on the assessment and management of flood risks",V,,,32007L0060,2006,15,COM,2006,COD,5,,,,
2007,9,7,"Regulation of the European Parliament and of the Council on public passenger transport services by rail and by road and repealing Council Regulations (EEC) Nos 1191/69 and 1107/70",V,,,32007R1370,2000,7,COM,2000,COD,212,,,,
2007,9,8,"Council Regulation laying down specific rules as regards the fruit and vegetable sector, amending Directives 2001/112/EC and 2001/113/EC and Regulations (EEC) No 827/68, (EC) No 2200/96, (EC) No 2201/96, (EC) No 2826/2000, (EC) No 1782/2003 and (EC) No 318/2006 and repealing Regulation (EC) No 2202/96",V,HU,,32007R1182,2007,17,COM,2007,CNS,12,,,,"Proposannée, ProposChrono and Proposorigine are not on the Celex document"
2007,9,9,"Council Directive amending Directive 2001/114/EC relating to certain partly or wholly dehydrated preserved milk for human consumption",V,FR,,32007L0061,2007,"58 - 1",COM,2007,CNS,25,,,,"Proposchrono in ŒIL and Celex documents is wrong (58). 58-1 as indicated on Pre-lex document is correct"
